{
  "schema_version": "ew-0.1",
  "case_status": "human_review_required",
  "allow_auto_reply": false,
  "allow_commitment": false,
  "allow_auto_execution": false,
  "human_review_required": true,
  "safety_action": "human_review_required",
  "risk_level": "high",
  "reason_code": "REFUND_COMMITMENT_WITHOUT_AUTHORITY",
  "recommended_response": "当前信息不足，需人工核实退款权限后再处理。",
  "audit_id": "audit_ecom_001",
  "review_role": "customer_service_supervisor",
  "review_queue": "after_sales_review",
  "relationships": [
    {
      "relation_type": "derived_from",
      "target_type": "output_envelope",
      "target_id": "run_ecom_001"
    },
    {
      "relation_type": "audited_by",
      "target_type": "audit",
      "target_id": "audit_ecom_001"
    }
  ]
}
